{
  "id": "design.ui-ux-pro-max",
  "name": "UI UX Pro Max",
  "version": "1.0.0",
  "category": "design",
  "description": "Guides AI assistants in UI/UX, design systems, accessibility and product interface decisions.",
  "tags": ["ui", "ux", "design-system", "frontend", "accessibility"],
  "entry": "skill.md"
}
